A1: Class# | B1: Date | C1: Period | D1: Topics | E1: Resources / Homework
A2: =IF(B2="","",COUNT($B$2:B2)) -> 1 | B2: 38968 | C2: 4 | D2: Introduction "I can't draw" activity www.unclefred.com/draw/panda/panda1.html Name creatures | E2: Please bring in one wire hanger for next class.
A3: =IF(B3="","",COUNT($B$2:B3)) -> 2 | B3: 38973 | C3: 2 | D3: Complete name creatures and laminate Introduce Pablo Picasso- on-line game | E3: Picasso website "Francoise, Claude & Paloma" "Weeping Woman" "Jacqueline with Flowers" Please complete name creatures for next class.
A4: =IF(B4="","",COUNT($B$2:B4)) -> 3 | B4: 38978 | C4: 4 | D4: Textured Face paintings | E4: Sketchbook Assignment Sept. #1: Find a painting by the artist Pablo Picasso, either in a book in the library or on the internet, and glue it in your sketchbook. (photocopy or print- preferably in colour but can be in black & white.) Be sure to include a title, name of painting and name of artist. (due next class)
A5: =IF(B5="","",COUNT($B$2:B5)) -> 4 | B5: 38981 | C5: 2 | D5: Picasso Sculptures- build Introduce Tessellations View some tessellations | E5: Complete Tessellation patterns for next class.
A6: =IF(B6="","",COUNT($B$2:B6)) -> 5 | B6: 38986 | C6: 4 | D6: Prime Picasso Sculptures Begin colouring tessellations | E6: Sketchbook Assignment Sept. #2: Do a line drawing of your self-portrait. Remember that lines can be thick or thin, straight or curvy. Experiment with different types of line. Use a mirror or draw from memory. (please use pencil)
A7: =IF(B7="","",COUNT($B$2:B7)) -> 6 | B7: 38989 | C7: 2 | D7: Design Picasso Sculptures
A8: =IF(B8="","",COUNT($B$2:B8)) -> 7 | B8: 38994 | C8: 4 | D8: Tessellations | E8: Sketchbook Assignment Oct. #1: Find an artwork by the artist M.C. Escher, either in a book in the library or on the internet, and glue it in your sketchbook. (photocopy or print- preferably in colour but can be in black & white.) Be sure to include a title, name of artwork and name of artist.
A9: =IF(B9="","",COUNT($B$2:B9)) -> 8 | B9: 39001 | C9: 2 | D9: Complete Tessellations View Escher websites when complete | E9: www.mcescher.com/ What are tessellations- http:www.tessellations.org/tess-what.htm Escher Web Sketch- http://marie.epfl.ch/escher/
A10: =IF(B10="","",COUNT($B$2:B10)) -> 9 | B10: 39006 | C10: 4 | D10: Paint sculptures | E10: Sketchbook Assignment Oct.#2: Create a tessellation using a repeated shape, try a shape other then an equilateral triangle. Add details.
A11: =IF(B11="","",COUNT($B$2:B11)) -> 10 | B11: 39009 | C11: 2 | D11: Complete sculptures | E11: Sketchbooks due next class (Oct.25). Please be sure to have completed Sept. #1, Sept. #2, Oct. #1 and Oct.#2. Include all titles and be sure to spend a minimum of 20 minutes on each sketch.- GLC Eligible Marking Checklist
A12: =IF(B12="","",COUNT($B$2:B12)) -> 11 | B12: 39015 | C12: 4 | D12: Edible Colour Wheels
A13: =IF(B13="","",COUNT($B$2:B13)) -> 12 | B13: 39020 | C13: 2 | D13: Last class to paint sculptures | E13: Sketchbook Assignment Oct.#3: Draw a lizard using only geometric shapes. Use a ruler.
A14: =IF(B14="","",COUNT($B$2:B14)) -> 13 | B14: 39023 | C14: 4 | D14: Begin colour theory- design shape | E14: Sketchbook Assignment Nov. #1: Find an artwork by the artist Paul Klee, either in a book in the library or on the internet, and glue it in your sketchbook. (photocopy or print- preferably in colour but can be in black & white.) Be sure to include a title, name of artwork and name of artist.
A15: =IF(B15="","",COUNT($B$2:B15)) -> 14 | B15: 39036 | C15: 2 | D15: Colour Wheels
A16: =IF(B16="","",COUNT($B$2:B16)) -> 15 | B16: 39041 | C16: 4 | D16: Complete Colour Wheels
A17: =IF(B17="","",COUNT($B$2:B17)) -> 16 | B17: 39044 | C17: 2 | D17: Introduce Paul Klee and watercolour painting project | E17: Sketchbook Assignment Nov.#2: Draw a picture on graph paper and glue into your sketchbooks. Fill in the squares with coloured pencils to form your image. Biography Artwork- Once Emerged from the Gray of Night
A18: =IF(B18="","",COUNT($B$2:B18)) -> 17 | B18: 39049 | C18: 4 | D18: Watercolour painting | E18: Sketchbook Assignment Nov.#3: Free Sketch!
A19: =IF(B19="","",COUNT($B$2:B19)) -> 18 | B19: 39052 | C19: 2 | D19: Watercolour painting | E19: Sketchbook Assignment Dec./Jan#1: Find an artwork by the artist Henry Moore, either in a book in the library or on the internet, and glue it in your sketchbook. (photocopy or print- preferably in colour but can be in black & white.) Be sure to include a title, name of artwork and name of artist.
A20: =IF(B20="","",COUNT($B$2:B20)) -> 19 | B20: 39057 | C20: 4 | D20: Watercolour painting
A21: =IF(B21="","",COUNT($B$2:B21)) -> 20 | B21: 39062 | C21: 2 | D21: Watercolour painting | E21: Sketchbook Assignment Dec./Jan.#2: Draw what Christmas means to you.
A22: =IF(B22="","",COUNT($B$2:B22)) -> 21 | B22: 39065 | C22: 4 | D22: Complete Watercolour painting
A23: =IF(B23="","",COUNT($B$2:B23)) -> 22 | B23: 39070 | C23: 2 | D23: Introduce Henry Moore Soft sculpture self-portraits (bust)-design
A24: =IF(B24="","",COUNT($B$2:B24)) -> 23 | B24: 39092 | C24: 4 | D24: Free period to finish Paul Klee watercolours or work on sketchbooks
A25: =IF(B25="","",COUNT($B$2:B25)) -> 24 | B25: 39097 | C25: 2 | D25: Henry Moore poems and drawings- due next class Henry Moore Interactive site | E25: Sketchbook Assignment Dec./Jan.#3: Free Sketch! Please bring in an empty water bottle (500ml). It needs to be filled with small rocks, rice or beans (something to make it heavy).
A26: =IF(B26="","",COUNT($B$2:B26)) -> 25 | B26: 39100 | C26: 4 | D26: Soft sculpture self-portraits
A27: =IF(B27="","",COUNT($B$2:B27)) -> 26 | B27: 39105 | C27: 2 | D27: Soft sculpture self-portraits
A28: =IF(B28="","",COUNT($B$2:B28)) -> 27 | B28: 39111 | C28: 4 | D28: Class cancelled- science workshop | E28: Sketchbooks due next class (Feb.1)- GLC Eligible October #3, Nov. #1,2,3 and Dec./Jan. #1,2,3 Marking Checklist
A29: =IF(B29="","",COUNT($B$2:B29)) -> 28 | B29: 39114 | C29: 2 | D29: Soft sculpture self-portraits | E29: Sketchbook Assignment Feb. #1: Find a painting by the artist Leonardo da Vinci, either in a book in the library or on the internet, and glue it in your sketchbook. (photocopy or print- preferably in colour but can be in black & white.) Be sure to include a title, name of painting and name of artist.
A30: =IF(B30="","",COUNT($B$2:B30)) -> 29 | B30: 39121 | C30: 4 | D30: Last class to complete soft sculptures
A31: =IF(B31="","",COUNT($B$2:B31)) -> 30 | B31: 39126 | C31: 2 | D31: Bookmark Contest | E31: Sketchbook Assignment Feb. #2: A shoe company has asked you to design their newest basketball shoe. Draw your new basketball shoe the size of the paper.
A32: =IF(B32="","",COUNT($B$2:B32)) -> 31 | B32: 39129 | C32: 4 | D32: Bookmark contest and catch up class (boys away in Ottawa)- please hand in bookmarks by next class
A33: =IF(B33="","",COUNT($B$2:B33)) -> 32 | B33: 39134 | C33: 2 | D33: Drywall sculptures | E33: Sketchbook Assignment Feb. #3: If you could go and visit any cartoon character, which one would it be? Draw a picture of what that visit to their world might look like.
A34: =IF(B34="","",COUNT($B$2:B34)) -> 33 | B34: 39139 | C34: 4 | D34: Drywall sculptures - design and begin carving
A35: =IF(B35="","",COUNT($B$2:B35)) -> 34 | B35: 39142 | C35: 2 | D35: Drywall sculptures - carving | E35: Sketchbook Assignments for March and April: Please include a title of your choice for each one ( and number from 1-6). Be creative with your titles and be sure to spend a min. of 20 minutes on each sketch. 1. If Mr. Ruscitti asked you to design the new school t-shirts for the MS, what would they look like? Draw your design and one sentence describing why you chose that design for our school. 2. If there were a flower that could eat people, what would it look like? 3.Draw what the inside of your head might look like. 4. Design a new video game. Draw and colour the new cover, complete with new title. 5. Draw a picture of yourself if you grew flowers instead of hair. 6. Design a new DVD cover for your favourite movie.
A36: =IF(B36="","",COUNT($B$2:B36)) -> 35 | B36: 39147 | C36: 4 | D36: CLASS CANCELLED due to Science Olympics
A37: =IF(B37="","",COUNT($B$2:B37)) -> 36 | B37: 39168 | C37: 2 | D37: Drywall Sculptures: FINISH CARVING | E37: Ensure that CARVING is completed before next class.
A38: =IF(B38="","",COUNT($B$2:B38)) -> 37 | B38: 39171 | C38: 4 | D38: Drywall Sculptures: Painting. Last in-class session.
A39: =IF(B39="","",COUNT($B$2:B39)) -> 38 | B39: 39176 | C39: 2 | D39: Elements of Design | E39: Homework - Complete drawing of 6 elements of design
A40: =IF(B40="","",COUNT($B$2:B40)) -> 39 | B40: 39183 | C40: 4 | D40: Elements of Design review. SHAPE: organic, geometric, amorphic | E40: Finish Shape Sketches
A41: =IF(B41="","",COUNT($B$2:B41)) -> 40 | B41: 39188 | C41: 2 | D41: Shape Collage - Last Class
A42: =IF(B42="","",COUNT($B$2:B42)) -> 41 | B42: 39191 | C42: 4 | D42: Leonardo Da Vinci (movie)Drawing Unit - Introduction Proportion Still Life - the face
A43: =IF(B43="","",COUNT($B$2:B43)) -> 42 | B43: 39196 | C43: 2 | D43: Still Life/The face
A44: =IF(B44="","",COUNT($B$2:B44)) -> 43 | B44: 39199 | C44: 4 | D44: Complete face drawings in classFaith Ringgold Story Telling and Printmaking | E44: Sketchbooks due next class (May 2). Please be sure to have completed Feb #1, Feb #2, Feb #3 and and 6 sketches for March/April. Include all titles and be sure to spend a minimum of 20 minutes on each sketch.- GLC Eligible Marking Checklist
A45: =IF(B45="","",COUNT($B$2:B45)) -> 44 | B45: 39204 | C45: 2 | D45: Printmaking Begin Story
A46: =IF(B46="","",COUNT($B$2:B46)) -> 45 | B46: 39209 | C46: 4 | D46: FINISH face drawingComplete Story Printmaking - Carving and application Demo - begin story sketch
A47: =IF(B47="","",COUNT($B$2:B47)) -> 46 | B47: 39212 | C47: 2 | D47: Printmaking - carving/story
A48: =IF(B48="","",COUNT($B$2:B48)) -> 47 | B48: 39217 | C48: 4 | D48: Printmaking - carving completed, begin story
A49: =IF(B49="","",COUNT($B$2:B49)) -> 48 | B49: 39224 | C49: 2 | D49: Last class for story and print - completed and mounted | E49: Portfolios
A50: =IF(B50="","",COUNT($B$2:B50)) -> 49 | B50: 39227 | C50: 4 | D50: Ceramics
A51: =IF(B51="","",COUNT($B$2:B51)) -> 50 | B51: 39232 | C51: 2
A52: =IF(B52="","",COUNT($B$2:B52)) -> 51 | B52: 39237 | C52: 4
A53: =IF(B53="","",COUNT($B$2:B53)) -> 52 | B53: 39240 | C53: 2